Artist,Sixties,Seventies,Eighties,Nineties,Two_Thousands,Twenty_Tens,Total Hits,Songs,Gender,Genre
enrique iglesias,0,0,0,1,4,3,8,"bailamos, be with you, hero, hero, escape, i like it, tonight im lovin you, bailando",male,
enya,0,0,0,0,1,0,1,only time,female,Irish_female_singers
erasure,0,0,0,1,0,0,1,always,,
eric benet,0,0,0,1,0,0,1,spend my life with you,,
eric burdon  war,0,1,0,0,0,0,1,spill the wine,,
eric carmen,0,1,2,0,0,0,3,"all by myself, hungry eyes, make me lose control",male,American_male_guitarists
eric church,0,0,0,0,0,1,1,springsteen,male,American_country_singers
eric clapton,0,3,2,3,0,0,8,"i shot the sheriff, lay down sally, promises, i cant stand it, ive got a rock n roll heart, tears in heaven, change the world, change the world",male,English_male_singers
eric weissberg  steve mandell,0,1,0,0,0,0,1,dueling banjos,,
erick sermon,0,0,0,0,1,0,1,music,male,African-American_male_rappers
eruption,0,1,0,0,0,0,1,i cant stand the rain,,
erykah badu,0,0,0,1,2,0,3,"on  on, bag lady, love of my life an ode to hiphop",female,African-American_female_singer-songwriters
estelle,0,0,0,0,1,0,1,american boy,female,English_female_rappers
eternal,0,0,0,1,0,0,1,stay,,
europe,0,0,1,0,0,0,1,carrie,,
eurythmics,0,0,3,0,0,0,3,"sweet dreams are made of this, here comes the rain again, would i lie to you",,
evan and jaron,0,0,0,0,1,0,1,crazy for this girl,,
evanescence,0,0,0,0,3,0,3,"bring me to life, my immortal, call me when youre sober",,
eve,0,0,0,0,2,0,2,"let me blow ya mind, gangsta lovin",female,Female_hip_hop_musicians
eve 6,0,0,0,0,1,0,1,heres to the night,,
evelyn champagne king,0,1,0,0,0,0,1,shame,,
everclear,0,0,0,0,1,0,1,wonderful,,
everlast,0,0,0,1,0,0,1,what its like,male,American_male_rappers
every mothers son,1,0,0,0,0,0,1,come on down to my boat,,
everything but the girl,0,0,0,1,0,0,1,missing,,
exile,0,1,0,0,0,0,1,kiss you all over,male,American_male_rappers
expose,0,0,5,1,0,0,6,"come go with me, let me be the one, point of no return, seasons change, what you dont know, ill never get over you getting over me",,
extreme,0,0,0,2,0,0,2,"more than words, hole hearted",,
fabolous,0,0,0,0,4,0,4,"into you, cant let you go, make me better, throw it in the bag",male,African-American_male_rappers
faith evans,0,0,0,4,1,0,5,"you used to love me, soon as i get home, love like this, all night long, i love you",female,African-American_female_singer-songwriters
faith hill,0,0,0,1,5,0,6,"this kiss, breathe, the way you love me, the way you love me, there youll be, mississippi girl",female,American_female_country_singers
faith no more,0,0,0,1,0,0,1,epic,,
falco,0,0,1,0,0,0,1,rock me amadeus,,
fall out boy,0,0,0,0,5,3,8,"sugar were goin down, dance dance, sugar were goin down, this aint a scene its an arms race, thnks fr th mmrs, my songs know what you did in the dark light em up, centuries, uma thurman",male,
fancy,0,1,0,0,0,0,1,wild thing,,
fantasia,0,0,0,0,1,0,1,truth is,,
far east movement,0,0,0,0,0,3,3,"like a g6, rocketeer, like a g6",,
fastball,0,0,0,1,0,0,1,out of my head,male,
fat joe,0,0,0,0,4,0,4,"whats luv, we thuggin, get it poppin, make it rain",,
fergie,0,0,0,0,6,0,6,"london bridge, big girls dont cry, glamorous, fergalicious, clumsy, big girls dont cry",female,American_female_singer-songwriters
fetty wap,0,0,0,0,0,3,3,"trap queen, 679, my way",male,African-American_male_rappers
field mob,0,0,0,0,2,0,2,"sick of being lonely, so what",,
fifth harmony,0,0,0,0,0,1,1,worth it,female,
filter,0,0,0,0,1,0,1,take a picture,male,
fine young cannibals,0,0,2,0,0,0,2,"she drives me crazy, good thing",male,
finger eleven,0,0,0,0,3,0,3,"one thing, paralyzer, paralyzer",,
firefall,0,1,0,0,0,0,1,strange way,,
firehouse,0,0,0,3,0,0,3,"love of a lifetime, when i look into your eyes, i live my life for you",,
five,0,0,0,1,0,0,1,when the lights go out,male,
five americans,1,0,0,0,0,0,1,western union,male,
five for fighting,0,0,0,0,2,0,2,"superman its not easy, 100 years",male,American_male_singers
five man electrical band,0,1,0,0,0,0,1,signs,male,
five stairsteps,0,1,0,0,0,0,1,ooh child,,
fleetwood mac,0,5,5,0,0,0,10,"say you love me, rhiannon, dreams, dont stop, go your own way, sara, tusk, hold me, little lies, big love",both,
flo rida,0,0,0,0,4,6,10,"low, in the ayer, right round, sugar, club cant handle me, wild ones, good feeling, whistle, i cry, gdfr",male,African-American_male_rappers
floetry,0,0,0,0,1,0,1,say yes,,
florida georgia line,0,0,0,0,0,4,4,"cruise, get your shine on, this is how we roll, dirt",,
focus,0,1,0,0,0,0,1,hocus pocus,,
foghat,0,1,0,0,0,0,1,slow ride,,
foo fighters,0,0,0,0,1,0,1,best of you,,
force mds,0,0,1,0,0,0,1,tender love,,
foreigner,0,4,5,0,0,0,9,"feels like the first time, cold as ice, hot blooded, double vision, urgent, waiting for a girl like you, i want to know what love is, say you will, i dont want to live without you",,
fort minor,0,0,0,0,1,0,1,whered you go,,
foster the people,0,0,0,0,0,1,1,pumped up kicks,,
four tops,3,0,0,0,0,0,3,"i cant help myself sugar pie honey bunch, its the same old song, bernadette",,
foxy,0,1,0,0,0,0,1,get off,,
foxy brown,0,0,0,1,0,0,1,ill be,,
frank  nancy sinatra,1,0,0,0,0,0,1,somethin stupid,both,
frank mills,0,1,0,0,0,0,1,music box dancer,,
frank sinatra,1,0,0,0,0,0,1,strangers in the night,male,American_crooners
frank stallone,0,0,1,0,0,0,1,far from over,male,American_male_singers
franke and the knockouts,0,0,1,0,0,0,1,sweetheart,male,
frankie j,0,0,0,0,2,0,2,"dont wanna try, obsession no es amor",male,American_male_singer-songwriters
frankie valli,1,3,0,0,0,0,4,"cant take my eyes off you, my eyes adored you, swearin to god, grease",male,American_male_pop_singers
freak nasty,0,0,0,1,0,0,1,da dip,male,African-American_male_rappers
freda payne,0,2,0,0,0,0,2,"band of gold, bring the boys home",female,African-American_female_singers
freddie and the dreamers,1,0,0,0,0,0,1,im telling you now,,
freddie hart,0,1,0,0,0,0,1,easy loving,male,American_country_singers
freddy fender,0,2,0,0,0,0,2,"before the next teardrop falls, wasted days and wasted nights",male,American_country_singers
free,0,1,0,0,0,0,1,all right now,,
frida,0,0,1,0,0,0,1,i know theres something going on,,
friend  lover,1,0,0,0,0,0,1,reach out of the darkness,,
frijid pink,0,1,0,0,0,0,1,the house of the rising sun,,
fuel,0,0,0,0,1,0,1,hemorrhage in my hands,,
fun,0,0,0,0,0,4,4,"we are young, some nights, some nights, carry on",,
gabrielle,0,0,0,1,0,0,1,dreams,female,English_female_pop_singers
gallery,0,1,0,0,0,0,1,nice to be with you,male,
gary lewis  the playboys,4,0,0,0,0,0,4,"this diamond ring, save your heart for me, count me in, shes just my style",male,
gary lewis and the playboys,1,0,0,0,0,0,1,sealed with a kiss,,
gary numan,0,0,1,0,0,0,1,cars,male,English_male_singer-songwriters
gary puckett  the union gap,5,0,0,0,0,0,5,"young girl, lady willpower, over you, woman woman, this girl is a woman now",,
gary us bonds,0,0,1,0,0,0,1,this little girl,,
gary wright,0,2,1,0,0,0,3,"love is alive, dream weaver, really wanna know you",male,American_male_singers
gavin degraw,0,0,0,0,3,1,4,"i dont want to be, chariot, in love with a girl, not over you",male,American_male_guitarists
gavin rossdale,0,0,0,0,1,0,1,love remains the same,male,English_male_singers
gene  debbe,1,0,0,0,0,0,1,playboy,,
gene chandler,0,1,0,0,0,0,1,groovy situation,male,African-American_male_singers
general public,0,0,0,1,0,0,1,ill take you there,,
genesis,0,0,7,3,0,0,10,"misunderstanding, thats all, invisible touch, throwing it all away, land of confusion, in too deep, tonight tonight tonight, i cant dance, hold on my heart, no son of mine",,
george benson,0,2,2,0,0,0,4,"this masquerade, on broadway, give me the night, turn your love around",male,American_male_guitarists
george duke  stanley clarke,0,0,1,0,0,0,1,sweet baby,,
george ezra,0,0,0,0,0,1,1,budapest,male,English_male_singer-songwriters
george harrison,0,2,2,0,0,0,4,"my sweet lord, give me love give me peace on earth, all those years ago, got my mind set on you",male,English_male_singer-songwriters
george mccrae,0,1,0,0,0,0,1,rock your baby,male,American_male_singers
george michael,0,0,7,4,0,0,11,"a different corner, i want your sex, faith, one more try, father figure, monkey, kissing a fool, praying for time, freedom 90, too funky, fastlove",male,English_male_singers
george michael and elton john,0,0,0,1,0,0,1,dont let the sun go down on me,,
george strait,0,0,0,1,2,0,3,"write this down, the best day, living and living well",male,American_country_singers
georgia satellites,0,0,1,0,0,0,1,keep your hands to yourself,,
georgie fame,1,0,0,0,0,0,1,the ballad of bonnie and clyde,male,English_male_singers
gerald levert,0,0,0,1,0,0,1,thinkin bout it,male,American_male_singers
gerardo,0,0,0,1,0,0,1,rico suave,,
gerry and the pacemakers,1,0,0,0,0,0,1,ferry cross the mersey,,
gerry rafferty,0,1,0,0,0,0,1,baker street,male,Male_guitarists
ghost town djs,0,0,0,1,0,0,1,my boo,,
gilbert osullivan,0,3,0,0,0,0,3,"alone again naturally, get down, clair",,
gin blossoms,0,0,0,3,0,0,3,"hey jealousy, found out about you, follow you down  til i hear it from you",male,
gina g,0,0,0,1,0,0,1,ooh aah just a little bit,female,Australian_female_pop_singers
gino vannelli,0,1,1,0,0,0,2,"i just wanna stop, living inside myself",male,Canadian_male_singers
ginuwine,0,0,0,3,4,0,7,"pony, pony, so anxious, differences, differences, in those jeans, hell yeah",male,African-American_male_singers
gladys knight  the pips,0,7,0,0,0,0,7,"if i were your woman, neither one of us wants to be the first to say goodbye, midnight train to georgia, best thing that ever happened to me, ive got to use my imagination, on and on, the way we weretry to remember",,
glass tiger,0,0,2,0,0,0,2,"dont forget me when im gone, someday",,
glen campbell,1,4,0,0,0,0,5,"galveston, its only make believe, rhinestone cowboy, country boy you got your feet in la, southern nights",male,American_country_singers
glenn frey,0,0,2,0,0,0,2,"the heat is on, you belong to the city",male,American_male_guitarists
glenn medeiros,0,0,1,0,0,0,1,nothings gonna change my love for you,male,American_male_singers
glenn medeiros and bobby brown,0,0,0,1,0,0,1,she aint worth it,,
glenn yarbrough,1,0,0,0,0,0,1,baby the rain must fall,male,American_male_singers
gloria estefan,0,0,1,3,0,0,4,"dont wanna lose you, here we are, coming out of the dark, turn the beat around",female,American_female_pop_singers
gloria estefan and miami sound machine,0,0,4,0,0,0,4,"rhythm is gonna get you, anything for you, 123, cant stay away from you",both,
gloria gaynor,0,2,0,0,0,0,2,"never can say goodbye, i will survive",female,American_female_singers
gloria loring and carl anderson,0,0,1,0,0,0,1,friends and lovers,,
gnarls barkley,0,0,0,0,1,0,1,crazy,male ,
go west,0,0,0,2,0,0,2,"king of wishful thinking, faithful",,
golden earring,0,1,1,0,0,0,2,"radar love, twilight zone",,
goo goo dolls,0,0,0,4,2,0,6,"name, slide, black balloon, iris, broadway, here is gone",,
gordon lightfoot,0,2,0,0,0,0,2,"if you could read my mind, sundown",male,Canadian_male_singers
gorillaz,0,0,0,0,2,0,2,"feel good inc, feel good inc",,
gotye,0,0,0,0,0,1,1,somebody that i used to know,male,Australian_male_singers
gq,0,2,0,0,0,0,2,"disco nights rockfreak, i do love you",,
grand funk,0,1,0,0,0,0,1,bad time,,
grand funk railroad,0,3,0,0,0,0,3,"were an american band, the locomotion, some kind of wonderful",male,
great white,0,0,1,0,0,0,1,once bitten twice shy,,
green day,0,0,0,0,4,0,4,"boulevard of broken dreams, holiday, wake me up when september ends, 21 guns",,
"green jell""y",0,0,0,1,0,0,1,three little pigs,,
greg guidry,0,0,1,0,0,0,1,goin down,male,
gregory abbott,0,0,1,0,0,0,1,shake you down,male,African-American_male_singers
gretchen wilson,0,0,0,0,1,0,1,redneck woman,female,American_female_country_singers
groove theory,0,0,0,2,0,0,2,"tell me, tell me",both,
grover washington jr  bill withers,0,0,1,0,0,0,1,just the two of us,male,
gunit,0,0,0,0,1,0,1,wanna get to know you,male,
guns n roses,0,0,4,1,0,0,5,"sweet child o mine, patience, welcome to the jungle, paradise city, november rain",,
gwen stefani,0,0,0,0,5,0,5,"hollaback girl, rich girl, cool, the sweet escape, wind it up",female,American_female_pop_singers
gym class heroes,0,0,0,0,1,3,4,"cupids chokehold, stereo hearts, ass back home, stereo hearts",,
haddaway,0,0,0,2,0,0,2,"what is love, what is love",male,
hall  oates,0,3,4,0,0,0,7,"sara smile, shes gone, rich girl, wait for me, kiss on my list, you make my dreams, youve lost that lovin feelin",,
hamilton joe frank  reynolds,0,2,0,0,0,0,2,"dont pull your love, fallin in love",,
hammer,0,0,0,2,0,0,2,"2 legit 2 quit, addams groove",,
hanson,0,0,0,2,0,0,2,"mmmbop, i will come to you",male,
harold faltermeyer,0,0,1,0,0,0,1,axel f,,
harold melvin  the blue notes,0,1,0,0,0,0,1,wake up everybody,,
harry chapin,0,2,0,0,0,0,2,"taxi, cats in the cradle",male,American_male_guitarists
harry nilsson,1,2,0,0,0,0,3,"everybodys talkin, without you, coconut",male,American_male_guitarists
havana brown,0,0,0,0,0,1,1,we run the night,female,Australian_female_pop_singers
heart,0,1,6,1,0,0,8,"barracuda, tell it like it is, what about love, never, these dreams, alone, who will you run to, all i wanna do is make love to you",female,
heatwave,0,3,0,0,0,0,3,"boogie nights, the groove line, always and forever",,
heavy d,0,0,0,1,0,0,1,big daddy,male,African-American_male_rappers
heavy d  the boyz,0,0,0,2,0,0,2,"now that we found love, got me waiting",,
helen reddy,0,7,0,0,0,0,7,"i dont know how to love him, delta dawn, peaceful, you and me against the world, leave me alone ruby red dress, angie baby, youre my world",female,American_female_pop_singers
hellogoodbye,0,0,0,0,1,0,1,here in your arms,,
henry gross,0,1,0,0,0,0,1,shannon,male,American_male_singer-songwriters
henry mancini,1,0,0,0,0,0,1,love theme from romeo and juliet,,
herb alpert,1,1,2,0,0,0,4,"this guys in love with you, rise, rise, diamonds",,
herb alpert and the tijuana brass,1,0,0,0,0,0,1,zorba the greek,,
hermans hermits,7,0,0,0,0,0,7,"cant you hear my heart beat, mrs brown youve got a lovely daughter, silhouettes, im henery the eighth i am, wonderful world, dandy, theres a kind of hush",,
hifive,0,0,0,3,0,0,3,"i like the way the kissing game, i cant wait another minute, shes playing hard to get",,
high inergy,0,1,0,0,0,0,1,you cant turn me off in the middle of turning me on,,
hinder,0,0,0,0,3,0,3,"lips of an angel, lips of an angel, better than me",,
honey cone,0,1,0,0,0,0,1,want ads,female,
hoobastank,0,0,0,0,1,0,1,the reason,,
hootie  the blowfish,0,0,0,6,0,0,6,"hold my hand, let her cry, only wanna be with you, time, old man and me when i get to heaven, only wanna be with you",,
horst jankowski,1,0,0,0,0,0,1,a walk in the black forest,male,
hot,0,1,0,0,0,0,1,angel in your arms,,
hot butter,0,1,0,0,0,0,1,popcorn,,
hot chelle rae,0,0,0,0,0,1,1,tonight tonight,,
hot chocolate,0,2,0,0,0,0,2,"you sexy thing, every 1s a winner",,
house of pain,0,0,0,1,0,0,1,jump around,male,
houston,0,0,0,0,1,0,1,i like that,male,African-American_male_singers
howard jones,0,0,2,0,0,0,2,"things can only get better, no one is to blame",male,African-American_male_singers
howie day,0,0,0,0,1,0,1,collide,male,American_male_guitarists
hozier,0,0,0,0,0,1,1,take me to church,male,
htown,0,0,0,1,0,0,1,knockin da boots,,
huey,0,0,0,0,1,0,1,pop lock  drop it,male,African-American_male_rappers
huey lewis and the news,0,0,10,0,0,0,10,"do you believe in love, the heart of rock  roll, i want a new drug, if this is it, the power of love, stuck with you, jacobs ladder, hip to be square, doing it all for my baby, perfect world",,
hugh masekela,1,0,0,0,0,0,1,grazing in the grass,,
hugo montenegro,1,0,0,0,0,0,1,the good the bad and the ugly,,
hunter hayes,0,0,0,0,0,3,3,"wanted, i want crazy, wanted",male,American_country_singers
hurricane chris,0,0,0,0,1,0,1,a bay bay,male,African-American_male_rappers
hurricane smith,0,1,0,0,0,0,1,oh babe what would you say,,
ian matthews,0,1,0,0,0,0,1,shake it,male,
ian whitcomb,1,0,0,0,0,0,1,you turn me on,male,English_male_singers
ice cube,0,0,0,3,0,0,3,"it was a good day, check yo self, bop gun one nation",male,African-American_male_rappers
icehouse,0,0,1,0,0,0,1,electric blue,,
icona pop,0,0,0,0,0,1,1,i love it,,
idina menzel,0,0,0,0,0,1,1,let it go,female,American_female_singer-songwriters
iggy azalea,0,0,0,0,0,2,2,"fancy, black widow",,
ike  tina turner,0,2,0,0,0,0,2,"i want to take you higher, proud mary",,
ilovemakonnen,0,0,0,0,0,1,1,tuesday,male,African-American_male_rappers
ilovememphis,0,0,0,0,0,1,1,hit the quan,male,African-American_male_rappers
imagine dragons,0,0,0,0,0,6,6,"its time, radioactive, its time, demons, demons, radioactive",,
immature,0,0,0,2,0,0,2,"never lie, constantly",male,
incubus,0,0,0,0,1,0,1,drive,,
information society,0,0,1,0,0,0,1,whats on your mind pure energy,,
ini kamoze,0,0,0,2,0,0,2,"here comes the hotstepper, here comes the hotstepper",,
inner circle,0,0,0,2,0,0,2,"bad boys, sweat a la la la la long",male,
inoj,0,0,0,2,0,0,2,"time after time, love you down",,
instant funk,0,1,0,0,0,0,1,i got my mind made up you can get it girl,,
inxs,0,0,5,1,0,0,6,"what you need, need you tonight, devil inside, new sensation, never tear us apart, disappear",,
irene cara,0,0,3,0,0,0,3,"fame, flashdance what a feeling, breakdance",female,American_female_country_singers
isaac hayes,0,1,1,0,0,0,2,"theme from shaft, dont let go",male,African-American_male_singers
iyaz,0,0,0,0,1,1,2,"replay, replay",,
j cole,0,0,0,0,0,2,2,"work out, power trip",,
j holiday,0,0,0,0,2,0,2,"bed, suffocate",,
ja rule,0,0,0,0,7,0,7,"put it on me, livin it up, always on time, down 4 u, livin it up, mesmerize, wonderful",male,African-American_male_rappers
jack jones,1,0,0,0,0,0,1,the race is on,male,American_crooners
jack wagner,0,0,1,0,0,0,1,all i need,male,American_male_singers
jackie deshannon,2,0,0,0,0,0,2,"what the world needs now is love, put a little love in your heart",female,American_female_rock_singers
jackie wilson,1,0,0,0,0,0,1,your love keeps lifting me higher and higher,male,African-American_male_singers
jackson browne,0,2,2,0,0,0,4,"doctor my eyes, running on empty, somebodys baby, lawyers in love",male,American_male_guitarists
jadakiss,0,0,0,0,1,0,1,why,male,African-American_male_rappers
jade,0,0,0,4,0,0,4,"i wanna love you, dont walk away, one woman, every day of the week",,
jagged edge,0,0,0,0,5,0,5,"lets get married, he cant love u, where the party at, promise, walked outta heaven",,
jaheim,0,0,0,0,2,0,2,"anything, put that woman first",male,African-American_male_singers
jake owen,0,0,0,0,0,2,2,"barefoot blue jean night, beachin",male,American_country_singers
james  bobby purify,1,0,0,0,0,0,1,im your puppet,,
james blunt,0,0,0,0,1,0,1,youre beautiful,male,English_male_singers
james brown,5,1,1,0,0,0,7,"papas got a brand new bag, cold sweat, i got the feelin, say it loud  im black and im proud, mother popcorn, get on the good foot, living in america",male,African-American_male_singers
james ingram,0,0,0,1,0,0,1,i dont have the heart,male,African-American_male_singers
james ingram and michael mcdonald,0,0,1,0,0,0,1,yah mo b there,,
james newton howard,0,0,0,0,0,1,1,the hanging tree,male,
james taylor,0,4,0,0,0,0,4,"fire and rain, youve got a friend, how sweet it is to be loved by you, handy man",male,American_male_guitarists
jamie foxx,0,0,0,0,2,0,2,"unpredictable, blame it",male,African-American_male_rappers
jamie walters,0,0,0,1,0,0,1,hold on,male,American_male_singers
jan hammer,0,0,1,0,0,0,1,miami vice theme,,
jane child,0,0,0,1,0,0,1,dont wanna fall in love,female,Canadian_female_pop_singers
janet,0,0,0,1,2,0,3,"together again, all for you, someone to call my lover",female,
janet jackson,0,0,6,16,1,0,23,"when i think of you, what have you done for me lately, nasty, control, lets wait awhile, miss you much, escapade, rhythm nation, alright, come back to me, black cat, love will never do without you, thats the way love goes, if, again, again, any time any place, because of love, runaway, you want this, runaway, i get lonely, doesnt really matter",female,African-American_female_singer-songwriters
janis ian,1,1,0,0,0,0,2,"societys child, at seventeen",female,American_female_guitarists
janis joplin,0,1,0,0,0,0,1,me and bobby mcgee,female,American_female_rock_singers
jann arden,0,0,0,1,0,0,1,insensitive,female,Canadian_female_pop_singers
jason aldean,0,0,0,0,1,5,6,"big green tractor, dirt road anthem, dont you wanna stay, take a little ride, fly over states, burnin it down",male,American_country_singers
"jason der""ulo",0,0,0,0,0,3,3,"in my head, ridin solo, whatcha say",,
jason derulo,0,0,0,0,1,6,7,"whatcha say, dont wanna go home, the other side, talk dirty, wiggle, trumpets, want to want me",male,American_male_pop_singers
jason mraz,0,0,0,0,3,1,4,"the remedy i wont worry, im yours, im yours, i wont give up",male,American_male_guitarists
jay  the techniques,1,0,0,0,0,0,1,apples peaches pumpkin pie,,
jay and the americans,2,0,0,0,0,0,2,"cara mia, this magic moment",,
jay ferguson,0,1,0,0,0,0,1,thunder island,male,American_male_singers
jay sean,0,0,0,0,1,2,3,"down, down, do you remember",,
jay z,0,0,0,0,0,1,1,holy grail,male,African-American_male_rappers
jayz,0,0,0,2,8,1,11,"can i get a, hard knock life ghetto anthem, big pimpin, izzo hova, i just wanna love u give it 2 me, 03 bonnie  clyde, excuse me miss, dirt off your shoulder, change clothes, run this town, young forever",,
jayz and alicia keys,0,0,0,0,1,1,2,"empire state of mind, empire state of mind",,
jayz and kanye west,0,0,0,0,0,1,1,niggas in paris,,
jayz and linkin park,0,0,0,0,1,0,1,numbencore,,
jd souther,0,0,1,0,0,0,1,youre only lonely,male,
jean knight,0,1,0,0,0,0,1,mr big stuff,female,American_female_singers
jeannie c riley,1,0,0,0,0,0,1,harper valley pta,,
jefferson airplane,2,0,0,0,0,0,2,"somebody to love, white rabbit",male,
jefferson starship,0,2,0,0,0,0,2,"with your love, count on me",,
jennifer lopez,0,0,0,1,9,1,11,"if you had my love, waiting for tonight, im real, love dont cost a thing, play, aint it funny, im gonna be alright, all i have, jenny from the block, get right, on the floor",female,American_female_pop_singers
jennifer paige,0,0,0,1,0,0,1,crush,female,American_female_singers
jennifer warnes,0,1,0,0,0,0,1,right time of the night,female,American_female_country_singers
jeremih,0,0,0,0,1,2,3,"birthday sex, down on me, dont tell em",male,African-American_male_singers
jeremy jordan,0,0,0,1,0,0,1,the right kind of love,male,American_male_singers
jermaine dupri,0,0,0,1,0,0,1,the party continues,male,African-American_male_rappers
jermaine jackson,0,1,2,0,0,0,3,"daddys home, lets get serious, do what you do",male,American_male_guitarists
jermaine stewart,0,0,1,0,0,0,1,we dont have to take our clothes off,male,American_male_singer-songwriters
jerrod niemann,0,0,0,0,0,1,1,lover lover,male,American_country_singers
jerry butler,3,0,0,0,0,0,3,"hey western union man, never give you up, only the strong survive",,
jerry butler  brenda lee eager,0,1,0,0,0,0,1,aint understanding mellow,both,
jerry reed,0,2,0,0,0,0,2,"amos moses, when youre hot youre hot",male,American_country_singers
jesse mccartney,0,0,0,0,3,0,3,"beautiful soul, leavin, how do you sleep",male,American_male_singer-songwriters
jesse powell,0,0,0,1,0,0,1,you,male,American_male_singers
jessi colter,0,1,0,0,0,0,1,im not lisa,female,American_female_country_singers
jessica andrews,0,0,0,0,1,0,1,who i am,female,American_female_country_singers
jessica simpson,0,0,0,0,3,0,3,"i wanna love you forever, irresistible, with you",female,American_female_country_singers
jessie j,0,0,0,0,0,2,2,"price tag, domino",female,English_female_pop_singers
jessie j ariana grande and nicki minaj,0,0,0,0,0,2,2,"bang bang, bang bang",,
jesus jones,0,0,0,2,0,0,2,"right here right now, real real real",,
jet,0,0,0,0,1,0,1,are you gonna be my girl,male,
jethro tull,0,1,0,0,0,0,1,bungle in the jungle,,
jewel,0,0,0,4,2,0,6,"who will save your soul, foolish games  you were meant for me, foolish games  you were meant for me, hands, standing still, intuition",female,American_female_country_singers
jewel akens,1,0,0,0,0,0,1,the birds and the bees,male,American_male_singers
jibbs,0,0,0,0,1,0,1,chain hang low,male,African-American_male_rappers
jidenna,0,0,0,0,0,1,1,classic man,male,African-American_male_singers
jim croce,0,4,0,0,0,0,4,"you dont mess around with jim, bad bad leroy brown, time in a bottle, ill have to say i love you in a song",male,American_male_guitarists
jim jones,0,0,0,0,2,0,2,"we fly high, pop champagne",male,African-American_male_rappers
jim stafford,0,3,0,0,0,0,3,"spiders and snakes, my girl bill, wildwood weed",male,American_male_singer-songwriters
jimmy buffett,0,1,0,0,0,0,1,margaritaville,male,American_country_singers
jimmy castor bunch,0,1,0,0,0,0,1,troglodyte cave man,,
jimmy cliff,0,0,0,1,0,0,1,i can see clearly now,,
jimmy eat world,0,0,0,0,1,0,1,the middle,,
jimmy ray,0,0,0,1,0,0,1,are you jimmy ray,male,English_male_singers
jimmy ruffin,1,0,0,0,0,0,1,what becomes of the brokenhearted,male,African-American_male_singers
jive bunny and the mastermixers,0,0,0,1,0,0,1,swing the mood,,
jkwon,0,0,0,0,1,0,1,tipsy,male,
jo dee messina,0,0,0,1,1,0,2,"a lesson in leavin, thats the way",female,American_female_country_singers
joan baez,0,1,0,0,0,0,1,the night they drove old dixie down,female,American_female_country_singers
joan jett  the blackhearts,0,0,1,0,0,0,1,crimson and clover,both,
joan jett and the blackhearts,0,0,2,0,0,0,2,"i love rock n roll, i hate myself for loving you",,
joan osborne,0,0,0,1,0,0,1,one of us,female,American_female_country_singers
jodeci,0,0,0,4,0,0,4,"come and talk to me, lately, cry for you, freekn you",,
