Artist,Sixties,Seventies,Eighties,Nineties,Two_Thousands,Twenty_Tens,Total Hits,Songs,Gender,Genre
jody watley,0,0,3,1,0,0,4,"looking for a new love, dont you want me, real love, everything",female,African-American_female_singer-songwriters
joe,0,0,0,2,2,0,4,"all the things your man wont do, dont wanna be a player, i wanna know, stutter",male,African-American_male_singers
joe cocker,0,2,0,0,0,0,2,"the letter, you are so beautiful",male,English_male_singers
joe cocker and jennifer warnes,0,0,1,0,0,0,1,up where we belong,,
joe jackson,0,0,2,0,0,0,2,"steppin out, breaking us in two",male,American_male_guitarists
joe public,0,0,0,1,0,0,1,live and learn,male,
joe simon,1,3,0,0,0,0,4,"the chokin kind, drowning in the sea of love, power of love, get down get down get on the floor",male,American_male_singers
joe south,1,1,0,0,0,0,2,"games people play, walk a mile in my shoes",male,American_male_guitarists
joe tex,1,2,0,0,0,0,3,"hold what youve got, i gotcha, aint gonna bump no more with no big fat woman",male,African-American_male_singers
joe walsh,0,1,1,0,0,0,2,"lifes been good, all night long",male,American_male_guitarists
joey lawrence,0,0,0,1,0,0,1,nothin my love cant fix,male,American_male_singer-songwriters
joey mcintyre,0,0,0,1,0,0,1,stay the same,male,American_male_singers
joey scarbury,0,0,1,0,0,0,1,theme from the greatest american hero believe it or not,male,American_male_singers
john cafferty  the beaver brown band,0,0,1,0,0,0,1,on the dark side,,
john cougar,0,0,3,0,0,0,3,"aint even done with the night, jack  diane, hurts so good",,
john cougar mellencamp,0,0,5,0,0,0,5,"pink houses, lonely ol night, rock in the usa, small town, cherry bomb",,
john denver,0,6,0,0,0,0,6,"take me home country roads, rocky mountain high, sunshine on my shoulders, annies song, thank god im a country boy, im sorry",male,American_country_singers
john fred  his playboy band,1,0,0,0,0,0,1,judy in disguise with glasses,,
john legend,0,0,0,0,2,1,3,"ordinary people, green light, all of me",male,American_male_singer-songwriters
john lennon,0,1,4,0,0,0,5,"instant karma, just like starting over, woman, watching the wheels, nobody told me",male,English_male_singer-songwriters
john mayer,0,0,0,0,6,0,6,"no such thing, your body is a wonderland, daughters, waiting on the world to change, waiting on the world to change, say",male,American_male_guitarists
john mellencamp,0,0,0,2,0,0,2,"wild night, key west intermezzo i saw you first",male,American_male_singers
john michael montgomery,0,0,0,0,1,0,1,letters from home,male,American_country_singers
john parr,0,0,1,0,0,0,1,st elmos fire man in motion,male,English_male_singers
john paul young,0,1,0,0,0,0,1,love is in the air,male,Australian_male_singers
john schneider,0,0,1,0,0,0,1,its now or never,male,American_male_guitarists
john sebastian,0,1,0,0,0,0,1,welcome back,male,American_male_guitarists
john stewart,0,1,0,0,0,0,1,gold,male,American_male_singer-songwriters
john travolta,0,1,0,0,0,0,1,let her in,male,American_male_singers
john travolta  olivia newtonjohn,0,2,0,0,0,0,2,"youre the one that i want, summer nights",,
john waite,0,0,1,0,0,0,1,missing you,male,English_male_singers
johnnie taylor,0,2,0,0,0,0,2,"i believe in you you believe in me, disco lady",male,American_male_singers
johnny bristol,0,1,0,0,0,0,1,hang on in there baby,male,American_male_singers
johnny cash,1,0,0,0,0,0,1,a boy named sue,male,American_country_singers
johnny gill,0,0,0,1,0,0,1,rub you the right way,,
johnny hates jazz,0,0,1,0,0,0,1,shattered dreams,,
johnny maestro  the brooklyn bridge,1,0,0,0,0,0,1,the worst that could happen,,
johnny mathis  deniece williams,0,1,0,0,0,0,1,too much too little too late,both,
johnny nash,1,2,0,0,0,0,3,"hold me tight, i can see clearly now, stir it up",,
johnny rivers,4,2,0,0,0,0,6,"the seventh son, poor side of town, secret agent man, baby i need your lovin, rockin pneumonia and the boogie woogie flu, swayin to the music slow dancing",male,American_male_guitarists
jojo,0,0,0,0,2,0,2,"leave get out, too little too late",female,American_female_pop_singers
jon b,0,0,0,2,0,0,2,"someone to love, they dont know",,
jon bon jovi,0,0,0,1,0,0,1,blaze of glory,male,American_male_guitarists
jon secada,0,0,0,4,0,0,4,"just another day, do you believe in us, angel, if you go",male,Male_songwriters
jonas brothers,0,0,0,0,1,0,1,burnin up,,
jonathan edwards,0,1,0,0,0,0,1,sunshine,male,American_country_singers
joni mitchell,0,1,0,0,0,0,1,help me,female,Canadian_female_pop_singers
jordan knight,0,0,0,1,0,0,1,give it to you,male,American_male_singer-songwriters
jordin sparks,0,0,0,0,3,0,3,"tattoo, one step at a time, battlefield",female,African-American_female_singer-songwriters
jordin sparks and chris brown,0,0,0,0,1,0,1,no air,,
jose feliciano,1,0,0,0,0,0,1,light my fire,,
joshua kadison,0,0,0,1,0,0,1,beautiful in my eyes,male,American_male_singer-songwriters
journey,0,0,5,1,0,0,6,"whos crying now, open arms, dont stop believin, separate ways worlds apart, faithfully, when you love a woman",male,
jr walker  the all stars,1,0,0,0,0,0,1,what does it take to win your love,,
jt money,0,0,0,1,0,0,1,who dat,,
jud strunk,0,1,0,0,0,0,1,daisy a day,male,American_country_singers
judy collins,0,1,0,0,0,0,1,amazing grace,female,American_female_guitarists
juelz santana,0,0,0,0,1,0,1,there it go the whistle song,male,African-American_male_rappers
juice newton,0,0,4,0,0,0,4,"queen of hearts, angel of the morning, the sweetest thing ive ever known, loves been a little bit hard on me",female,American_female_country_singers
julian lennon,0,0,2,0,0,0,2,"too late for goodbyes, valotte",male,English_male_singers
julio iglesias and willie nelson,0,0,1,0,0,0,1,to all the girls ive loved before,,
junior mafia,0,0,0,2,0,0,2,"players anthem, get money",male,
junior walker  the all stars,1,0,0,0,0,0,1,shotgun,,
justin bieber,0,0,0,0,1,5,6,"one time, baby, boyfriend, as long as you love me, beauty and a beat, what do you mean",male,Canadian_male_singers
justin timberlake,0,0,0,0,10,3,13,"like i love you, cry me a river, rock your body, sexyback, my love, what goes around comes around, my love, summer love, sexyback, lovestoned, mirrors, suit  tie, not a bad thing",male,American_male_pop_singers
juvenile,0,0,0,1,1,0,2,"back that azz up, slow motion",male,African-American_male_rappers
k p  envyi,0,0,0,1,0,0,1,swing my way,female,
kajagoogoo,0,0,1,0,0,0,1,too shy,,
kandi,0,0,0,0,1,0,1,dont think im not,,
kansas,0,2,0,0,0,0,2,"carry on wayward son, dust in the wind",,
kanye west,0,0,0,0,11,1,12,"jesus walks, all falls down, through the wire, gold digger, gold digger, stronger, love lockdown, good life, flashing lights, heartless, love lockdown, all of the lights",male,African-American_male_rappers
kanye west big sean pusha t and 2 chainz,0,0,0,0,0,1,1,mercy,,
kardinal offishall,0,0,0,0,1,0,1,dangerous,,
karla bonoff,0,0,1,0,0,0,1,personally,female,American_female_singer-songwriters
karmin,0,0,0,0,0,1,1,brokenhearted,,
karyn white,0,0,2,2,0,0,4,"the way you love me, secret rendezvous, romantic, the way i feel about you",female,American_female_singers
kathy troccoli,0,0,0,1,0,0,1,everything changes,female,American_female_singers
katrina and the waves,0,0,1,0,0,0,1,walking on sunshine,female,
katy perry,0,0,0,0,4,13,17,"i kissed a girl, hot n cold, hot n cold, waking up in vegas, california gurls, teenage dream, firework, et, last friday night tgif, teenage dream, wide awake, part of me, the one that got away, roar, dark horse, roar, birthday",female,American_female_guitarists
kc  the sunshine band,0,0,1,0,0,0,1,give it up,,
kc and the sunshine band,0,5,1,0,0,0,6,"get down tonight, shake shake shake shake your booty, thats the way i like it, im your boogie man, keep it comin love, please dont go",,
kci  jojo,0,0,0,2,1,0,3,"all my life, tell me its real, crazy",,
keha,0,0,0,0,0,7,7,"tik tok, your love is my drug, blah blah blah, take it off, we r who we r, blow, die young",,
keith,1,0,0,0,0,0,1,986,male,American_male_singers
keith carradine,0,1,0,0,0,0,1,im easy,,
keith sweat,0,0,1,7,0,0,8,"i want her, make you sweat, ill give all my love to you, keep it comin, twisted, nobody, nobody, twisted",male,American_male_singers
keith urban,0,0,0,0,1,0,1,youll think of me,male,Male_guitarists
kelis,0,0,0,0,2,0,2,"milkshake, bossy",female,African-American_female_singer-songwriters
kelly clarkson,0,0,0,0,13,4,17,"a moment like this, miss independent, breakaway, since u been gone, behind these hazel eyes, breakaway, because of you, because of you, walk away, never again, my life would suck without you, i do not hook up, already gone, already gone, stronger what doesnt kill you, catch my breath, heartbeat song",female,American_female_pop_singers
kelly price,0,0,0,1,0,0,1,friend of mine,female,African-American_female_singers
kelly rowland,0,0,0,0,0,1,1,motivation,female,African-American_female_singer-songwriters
kendrick lamar,0,0,0,0,0,1,1,swimming pools drank,male,African-American_male_rappers
kenny chesney,0,0,0,1,5,3,9,"how forever feels, dont happen twice, the good stuff, no shoes no shirt no problems, when the sun goes down, i go back, you and tequila, come over, american kids",male,American_country_singers
kenny g,0,0,1,1,0,0,2,"songbird, forever in love",,
kenny loggins,0,0,5,0,0,0,5,"this is it, heart to heart, footloose, danger zone, meet me half way",male,American_country_singers
kenny loggins  stevie nicks,0,1,0,0,0,0,1,whenever i call you friend,,
kenny nolan,0,2,0,0,0,0,2,"i like dreamin, loves grown deep",male,American_male_singers
kenny rogers,0,3,6,0,0,0,9,"lucille, the gambler, she believes in me, coward of the county, you decorated my life, lady, i dont need you, love will turn you around, through the years",male,American_country_singers
kenny rogers  kim carnes,0,0,1,0,0,0,1,dont fall in love with a dreamer,,
kenny rogers  the first edition,1,1,0,0,0,0,2,"ruby dont take your love to town, somethings burning",both,
kenny rogers and dolly parton,0,0,1,0,0,0,1,islands in the stream,,
kenny rogers and sheena easton,0,0,1,0,0,0,1,weve got tonight,,
keri hilson,0,0,0,0,2,1,3,"knock you down, turnin me on, pretty girl rock",female,African-American_female_singer-songwriters
kesha,0,0,0,0,0,1,1,die young,female,American_female_singer-songwriters
kevin lyttle,0,0,0,0,1,0,1,turn me on,male,
kevin rudolf,0,0,0,0,2,1,3,"let it rock, let it rock, i made it cash money heroes",male,American_male_guitarists
kevon edmonds,0,0,0,0,1,0,1,247,,
keyshia cole,0,0,0,0,4,0,4,"love, let it go, i remember, heaven sent",female,African-American_female_singer-songwriters
kid cudi,0,0,0,0,1,0,1,day n nite,male,African-American_male_rappers
kid ink,0,0,0,0,0,1,1,show me,male,African-American_male_rappers
kid rock,0,0,0,0,3,0,3,"only god knows why, picture, all summer long",male,American_male_guitarists
kim carnes,0,0,2,0,0,0,2,"more love, bette davis eyes",female,American_female_country_singers
kim wilde,0,0,2,0,0,0,2,"kids in america, you keep me hangin on",female,English_female_pop_singers
king floyd,0,1,0,0,0,0,1,groove me,male,American_male_singers
king harvest,0,1,0,0,0,0,1,dancing in the moonlight,,
kings of leon,0,0,0,0,1,1,2,"use somebody, use somebody",male,
kip moore,0,0,0,0,0,1,1,somethin bout a truck,male,American_male_guitarists
kirko bangz,0,0,0,0,0,1,1,drank in my cup,male,African-American_male_rappers
kiss,0,2,0,1,0,0,3,"rock and roll all nite live, i was made for lovin you, forever",male,
klymaxx,0,0,1,0,0,0,1,i miss you,,
kongos,0,0,0,0,0,1,1,come with me now,male,
kool  the gang,0,2,11,0,0,0,13,"jungle boogie, hollywood swinging, ladies night, too hot, celebration, get down on it, take my heart you can have it if you want it, joanna, tonight, cherish, misled, fresh, victory",male,
kris kristofferson,0,1,0,0,0,0,1,why me,male,American_country_singers
kris kross,0,0,0,4,0,0,4,"jump, warm it up, alright, tonites tha night ",,
kristinia debarge,0,0,0,0,1,0,1,goodbye,female,American_female_singers
kt tunstall,0,0,0,0,1,0,1,black horse and the cherry tree,female,Female_rock_singers
kws,0,0,0,1,0,0,1,please dont go,,
kylie minogue,0,0,1,0,1,0,2,"the locomotion, cant get you out of my head",female,Australian_female_pop_singers
kyper,0,0,0,1,0,0,1,tictactoe,,
la bouche,0,0,0,2,0,0,2,"be my lover, sweet dreams",,
la roux,0,0,0,0,0,1,1,bulletproof,,
labelle,0,1,0,0,0,0,1,lady marmalade,,
lady antebellum,0,0,0,0,1,5,6,"i run to you, need you now, american honey, just a kiss, downtown, bartender",female,
lady gaga,0,0,0,0,4,9,13,"poker face, just dance, lovegame, paparazzi, bad romance, telephone, alejandro, paparazzi, born this way, the edge of glory, yo""u and i, applause, do what u want",female,American_female_pop_singers
lamont dozier,0,1,0,0,0,0,1,trying to hold on to my woman,,
lana del rey and cedric gervais,0,0,0,0,0,1,1,summertime sadness,,
larry groce,0,1,0,0,0,0,1,junk food junkie,male,American_male_singer-songwriters
laura branigan,0,0,5,0,0,0,5,"gloria, gloria, solitaire, how am i supposed to live without you, self control",female,American_female_pop_singers
lauryn hill,0,0,0,2,0,0,2,"doo wop that thing, exfactor",female,American_female_guitarists
leann rimes,0,0,0,3,2,0,5,"how do i live, how do i live, looking through your eyes, i need you, cant fight the moonlight",female,American_female_country_singers
leblanc  carr,0,1,0,0,0,0,1,falling,,
lee ann womack,0,0,0,0,2,0,2,"i hope you dance, i hope you dance",female,American_female_country_singers
lee brice,0,0,0,0,0,2,2,"hard to love, i dont dance",male,American_country_singers
lee dorsey,1,0,0,0,0,0,1,working in the coal mine,male,American_male_singers
lee michaels,0,1,0,0,0,0,1,do you know what i mean,male,American_male_guitarists
leif garrett,0,1,0,0,0,0,1,i was made for dancin,male,American_male_singers
len,0,0,0,1,0,0,1,steal my sunshine,,
lenny kravitz,0,0,0,2,1,0,3,"it aint over til its over, fly away, again",male,African-American_male_singers
leo sayer,0,4,1,0,0,0,5,"long tall glasses, you make me feel like dancing, when i need you, how much love, more than i can say",male,English_male_singers
leona lewis,0,0,0,0,2,0,2,"bleeding love, better in time",female,British_female_singers
lesley gore,1,0,0,0,0,0,1,california nights,female,American_female_pop_singers
level 42,0,0,1,0,0,0,1,something about you,,
levert,0,0,1,0,0,0,1,casanova,,
lfo,0,0,0,1,1,0,2,"summer girls, girl on tv",,
lifehouse,0,0,0,0,4,0,4,"hanging by a moment, you and me, you and me, first time",,
lil bow wow,0,0,0,0,1,0,1,bounce with me,,
lil flip,0,0,0,0,2,0,2,"sunshine, game over flip",,
lil jon,0,0,0,0,2,0,2,"lovers  friends, snap yo fingers",male,African-American_male_rappers
lil jon  the east side boyz,0,0,0,0,2,0,2,"get low, get low",,
lil kim,0,0,0,2,2,0,4,"not tonight, no time, magic stick, the jump off",male,
lil mo,0,0,0,0,1,0,1,superwoman pt ii,,
lil romeo,0,0,0,0,1,0,1,my baby,male,
lil wayne,0,0,0,0,4,6,10,"lollipop, got money, a milli, mrs officer, right above it, how to love, 6 foot 7 foot, she will, love me, believe me",male,African-American_male_rappers
linda ronstadt,0,5,2,0,0,0,7,"when will i be loved, youre no good, blue bayou, its so easy, ooo baby baby, how do i make you, hurt so bad",female,American_female_country_singers
linda ronstadt and aaron neville,0,0,0,1,0,0,1,dont know much,both,
linda ronstadt and james ingram,0,0,1,0,0,0,1,somewhere out there,,
lindsey buckingham,0,0,1,0,0,0,1,trouble,male,American_male_guitarists
linear,0,0,0,1,0,0,1,sending all my love,male,
linkin park,0,0,0,0,6,1,7,"in the end, numb, breaking the habit, what ive done, shadow of the day, new divide, burn it down",,
lionel richie,0,0,12,0,0,0,12,"you are, truly, my love, hello, all night long all night, stuck on you, running with the night, penny lover, say you say me, dancing on the ceiling, love will conquer all, ballerina girl",male,American_country_singers
lipps inc,0,0,1,0,0,0,1,funkytown,,
lisa lisa and cult jam,0,0,3,0,0,0,3,"all cried out, head to toe, lost in emotion",,
lisa loeb,0,0,0,1,0,0,1,i do,female,American_female_guitarists
lisa loeb and nine stories,0,0,0,1,0,0,1,stay i missed you,both,
lisa stansfield,0,0,0,1,0,0,1,all around the world,female,English_female_pop_singers
lita ford and ozzy osbourne,0,0,1,0,0,0,1,close my eyes forever,both,
little anthony and the imperials,1,0,0,0,0,0,1,take me back,,
little big town,0,0,0,0,0,2,2,"pontoon, girl crush",,
little river band,0,3,4,0,0,0,7,"reminiscing, lady, lonesome loser, cool change, take it easy on me, man on your mind, the other guy",,
ll cool j,0,0,0,5,2,0,7,"around the way girl, hey lover, loungin, doin it, father, luv u better, headsprung",male,African-American_male_rappers
lloyd,0,0,0,0,3,0,3,"southside, you, get it shawty",male,African-American_male_singers
lloyd banks,0,0,0,0,1,0,1,on fire,male,African-American_male_rappers
lmfao,0,0,0,0,0,4,4,"party rock anthem, sexy and i know it, sexy and i know it, party rock anthem",,
lobo,0,2,0,0,0,0,2,"me and you and a dog named boo, dont expect me to be your friend",male,American_male_singer-songwriters
loggins and messina,0,1,0,0,0,0,1,your mama dont dance,,
london symphony orchestra,0,1,0,0,0,0,1,star wars main title,both,
londonbeat,0,0,0,1,0,0,1,ive been thinking about you,,
lonestar,0,0,0,1,4,0,5,"amazed, amazed, what about now, im already there, my front porch looking in",male,
looking glass,0,1,0,0,0,0,1,brandy youre a fine girl,male,
lord david dundas,0,1,0,0,0,0,1,jeans on,male,English_male_singers
lord tariq and peter gunz,0,0,0,1,0,0,1,deja vu uptown baby,,
lorde,0,0,0,0,0,3,3,"royals, team, royals",female,New_Zealand_female_pop_singers
loreena mckennitt,0,0,0,1,0,0,1,the mummers dance,female,Canadian_female_singers
los bravos,1,0,0,0,0,0,1,black is black,male,
los del r'io,0,0,0,3,0,0,3,"macarena bayside boys mix, macarena, macarena bayside boys mix",,
los lobos,0,0,1,0,0,0,1,la bamba,,
los lonely boys,0,0,0,0,1,0,1,heaven,,
lou bega,0,0,0,1,0,0,1,mambo no 5,male,
lou christie,2,0,0,0,0,0,2,"lightnin strikes, im gonna make you mine",,
lou gramm,0,0,1,1,0,0,2,"midnight blue, just between you and me",male,American_male_singer-songwriters
lou rawls,2,1,0,0,0,0,3,"love is a hurtin thing, your good thing is about to end, youll never find another love like mine",male,American_male_singers
love and rockets,0,0,1,0,0,0,1,so alive,female,
love unlimited,0,1,0,0,0,0,1,walkin in the rain with the one i love,,
love unlimited orchestra,0,1,0,0,0,0,1,loves theme,,
loverboy,0,0,2,0,0,0,2,"working for the weekend, hot girls in love",,
lovin spoonful,1,0,0,0,0,0,1,summer in the city,male,
lsg,0,0,0,1,0,0,1,my body,,
ltd,0,1,0,0,0,0,1,every time i turn around back in love again,,
ludacris,0,0,0,0,12,2,14,"southern hospitality, move bitch, rollout my business, stand up, splash waterfalls, stand up, pimpin all over the world, get back, number one spot, money maker, runaway love, money maker, how low, my chick bad",male,African-American_male_rappers
luke,0,0,0,1,0,0,1,raise the roof,,
luke bryan,0,0,0,0,0,7,7,"country girl shake it for me, drunk on you, i dont want this night to end, crash my party, thats my kind of night, play it again, kick the dust up",male,American_country_singers
lulu,1,0,0,0,0,0,1,to sir with love,,
lumidee,0,0,0,0,1,0,1,never leave you uh oooh uh oooh,female,American_female_singers
luniz,0,0,0,1,0,0,1,i got 5 on it,,
lupe fiasco,0,0,0,0,1,1,2,"superstar, the show goes on",male,African-American_male_rappers
luscious jackson,0,0,0,1,0,0,1,naked eye,,
luther ingram,0,1,0,0,0,0,1,if loving you is wrong i dont want to be right,male,American_male_singers
luther vandross,0,0,0,2,0,0,2,"here and now, power of lovelove power",male,African-American_male_singers
luther vandross and janet jackson,0,0,0,1,0,0,1,the best things in life are free,,
luther vandross and mariah carey,0,0,0,1,0,0,1,endless love,,
lynn anderson,0,1,0,0,0,0,1,rose garden,female,American_female_country_singers
lynyrd skynyrd,0,1,0,0,0,0,1,whats your name,,
m,0,0,1,0,0,0,1,pop muzik,,
m'ya,0,0,0,0,3,0,3,"case of the ex, case of the ex, my love is likewo",,
m'ya and sisqo,0,0,0,1,0,0,1,its all about me,female,
"m""otley cr""ue",0,0,0,1,0,0,1,without you,,
mac and katie kissoon,0,1,0,0,0,0,1,chirpy chirpy cheep cheep,both,
mac davis,0,2,0,0,0,0,2,"baby dont get hooked on me, one hell of a woman",male,American_country_singers
macklemore  ryan lewis,0,0,0,0,0,1,1,white walls,,
macklemore and ryan lewis,0,0,0,0,0,4,4,"thrift shop, cant hold us, same love, downtown",,
macy gray,0,0,0,0,1,0,1,i try,female,African-American_female_singer-songwriters
madness,0,0,1,0,0,0,1,our house,,
madonna,0,0,18,14,4,0,36,"borderline, lucky star, holiday, like a virgin, crazy for you, material girl, angel, dress you up, papa dont preach, live to tell, true blue, open your heart, whos that girl, causing a commotion, la isla bonita, like a prayer, express yourself, cherish, vogue, justify my love, this used to be my playground, deeper and deeper, rain, ill remember, secret, take a bow, secret, youll see, dont cry for me argentina, you must love me, frozen, ray of light, music, dont tell me, hung up, 4 minutes",female,American_female_pop_singers
magic,0,0,0,0,0,1,1,rude,male,African-American_male_rappers
major harris,0,1,0,0,0,0,1,love wont let me wait,male,African-American_male_singers
major lazer and dj snake,0,0,0,0,0,1,1,lean on,,
mama cass elliot,1,0,0,0,0,0,1,its getting better,,
manfred mann,1,0,0,0,0,0,1,the mighty quinn,male,
manfred manns earth band,0,1,0,0,0,0,1,blinded by the light,male,
marc anthony,0,0,0,1,2,0,3,"i need to know, you sang to me, i need to know",male,American_male_singers
marcy playground,0,0,0,1,0,0,1,sex and candy,,
maria muldaur,0,1,0,0,0,0,1,midnight at the oasis,female,American_female_singers
mariah carey,0,0,0,20,8,1,29,"vision of love, love takes time, someday, emotions, i dont wanna cry, love takes time, ill be there, cant let go, make it happen, dreamlover, hero, without you  never forget you, anytime you need a friend, fantasy, always be my baby, fantasy, honey, my all, heartbreaker, i still believe, thank god i found you, loverboy, we belong together, shake it off, its like that, dont forget about us, touch my body, obsessed, beautiful",female,African-American_female_singer-songwriters
mariah carey and boyz ii men,0,0,0,1,0,0,1,one sweet day,,
marilyn mccoo  billy davis jr,0,1,0,0,0,0,1,you dont have to be a star to be in my show,,
mario,0,0,0,0,3,0,3,"just a friend 2002, let me love you, break up",,
mario winans,0,0,0,0,1,0,1,i dont wanna know,male,African-American_male_singers
mark chesnutt,0,0,0,1,0,0,1,i dont want to miss a thing,male,American_country_singers
mark lindsay,0,1,0,0,0,0,1,arizona,male,American_male_singer-songwriters
mark morrison,0,0,0,1,0,0,1,return of the mack,male,English_male_singers
mark ronson,0,0,0,0,0,1,1,uptown funk,male,English_male_singers
mark wills,0,0,0,0,1,0,1,19 somethin,male,American_country_singers
marky mark and the funky bunch,0,0,0,2,0,0,2,"good vibrations, wildside",,
marmalade,0,1,0,0,0,0,1,reflections of my life,,
maroon 5,0,0,0,0,4,12,16,"this love, she will be loved, she will be loved, makes me wonder, misery, moves like jagger, payphone, one more night, moves like jagger, daylight, one more night, love somebody, maps, animals, sugar, animals",,
martha and the vandellas,2,0,0,0,0,0,2,"nowhere to run, jimmy mack",,
martika,0,0,1,0,0,0,1,toy soldiers,female,American_female_singers
martin garrix,0,0,0,0,0,1,1,animals,,
martin page,0,0,0,1,0,0,1,in the house of stone and light,male,English_male_singers
marty balin,0,0,1,0,0,0,1,hearts,male,American_male_singers
marvin gaye,5,4,1,0,0,0,10,"ill be doggone, how sweet it is to be loved by you, too busy thinking about my baby, thats the way love is, i heard it through the grapevine, whats going on, mercy mercy me the ecology, lets get it on, got to give it up, sexual healing",male,American_male_singer-songwriters
marvin gaye  tammi terrell,4,0,0,0,0,0,4,"your precious love, aint no mountain high enough, aint nothing like the real thing, youre all i need to get by",,
marvin hamlisch,0,1,0,0,0,0,1,the entertainer,,
mary hopkin,1,0,0,0,0,0,1,those were the days,,
mary j blige,0,0,0,3,6,0,9,"real love, real love, not gon cry, family affair, family affair, rainy dayz, no more drama, be without you, just fine",,
mary jane girls,0,0,1,0,0,0,1,in my house,,
mary macgregor,0,1,0,0,0,0,1,torn between two lovers,female,American_female_country_singers
mary mary,0,0,0,0,1,0,1,shackles praise you,,
mase,0,0,0,3,0,0,3,"what you want, feel so good, lookin at me",male,African-American_male_rappers
mason williams,1,0,0,0,0,0,1,classical gas,male,American_male_guitarists
master p,0,0,0,2,0,0,2,"make em say uhh, i got the hook up",male,African-American_male_rappers
matchbox 20,0,0,0,1,0,0,1,back 2 good,,
matchbox twenty,0,0,0,0,3,0,3,"bent, if youre gone, unwell",,
matthew wilder,0,0,1,0,0,0,1,break my stride,male,American_male_singer-songwriters
matthews southern comfort,0,1,0,0,0,0,1,woodstock,,
maureen mcgovern,0,1,0,0,0,0,1,the morning after,,
maxi priest,0,0,0,2,0,0,2,"close to you, that girl",male,English_male_singers
maxine nightingale,0,2,0,0,0,0,2,"right back where we started from, lead me on",female,English_female_pop_singers
maxwell,0,0,0,1,1,0,2,"fortunate, pretty wings",male,American_male_guitarists
mc hammer,0,0,0,2,0,0,2,"have you seen her, u cant touch this",male,African-American_male_rappers
mc lyte,0,0,0,2,0,0,2,"keep on keepin on, cold rock a party",,
mcfadden  whitehead,0,1,0,0,0,0,1,aint no stoppin us now,male,
meat loaf,0,1,0,3,0,0,4,"two out of three aint bad, id do anything for love but i wont do that, id do anything for love but i wont do that, rock and roll dreams come through",male,American_male_singers
meco,0,1,0,0,0,0,1,star wars themecantina band,,
meek mill,0,0,0,0,0,1,1,all eyes on you,male,African-American_male_rappers
