Artist,Sixties,Seventies,Eighties,Nineties,Two_Thousands,Twenty_Tens,Total Hits,Songs,Gender,Genre
meghan trainor,0,0,0,0,0,5,5,"all about that bass, lips are movin, all about that bass, dear future husband, like im gonna lose you",female,American_female_pop_singers
mel and tim,0,1,0,0,0,0,1,starting all over again,,
mel carter,1,0,0,0,0,0,1,hold me thrill me kiss me,male,American_male_singers
melanie,0,2,0,0,0,0,2,"lay down candles in the rain, brand new key",female,
melissa etheridge,0,0,0,4,0,0,4,"come to my window, im the only one, like the way i do, i want to come over",female,American_female_guitarists
melissa manchester,0,2,1,0,0,0,3,"midnight blue, dont cry out loud, you should hear how she talks about you",female,American_female_singers
mellow man ace,0,0,0,1,0,0,1,mentirosa,male,
men at work,0,0,4,0,0,0,4,"who can it be now, down under, overkill, its a mistake",,
men without hats,0,0,1,0,0,0,1,the safety dance,,
mercy,1,0,0,0,0,0,1,love can make you happy,,
meredith brooks,0,0,0,1,0,0,1,bitch,female,American_female_guitarists
merril bainbridge,0,0,0,2,0,0,2,"mouth, mouth",female,Australian_female_pop_singers
merrilee rush,1,0,0,0,0,0,1,angel of the morning,,
metallica,0,0,0,1,0,0,1,until it sleeps,,
method man,0,0,0,1,0,0,1,ill be there for youyoure all i need to get by,male,African-American_male_rappers
metro station,0,0,0,0,1,0,1,shake it,,
mfsb,0,1,0,0,0,0,1,tsop the sound of philadelphia,,
mia,0,0,0,0,1,0,1,paper planes,,
miami sound machine,0,0,3,0,0,0,3,"conga, words get in the way, bad boy",,
michael bolton,0,0,0,10,0,0,10,"how am i supposed to live without you, how can we be lovers, when im back on my feet again, love is a wonderful thing, time love and tenderness, when a man loves a woman, missing you now, to love somebody, said i loved youbut i lied, go the distance",male,American_male_singer-songwriters
michael buble,0,0,0,0,0,1,1,havent met you yet,male,
michael damian,0,0,1,0,0,0,1,rock on,male,American_male_singers
michael franti  spearhead,0,0,0,0,1,0,1,say hey i love you,,
michael jackson,0,3,13,5,1,0,22,"ben, rockin robin, dont stop til you get enough, rock with you, shes out of my life, off the wall, billie jean, beat it, wanna be startin somethin, human nature, thriller, bad, man in the mirror, the way you make me feel, dirty diana, smooth criminal, black or white, remember the time, in the closet, will you be there, you are not alone, butterflies",male,African-American_male_singers
michael jackson and janet jackson,0,0,0,1,0,0,1,scream,,
michael jackson and justin timberlake,0,0,0,0,0,1,1,love never felt so good,,
michael jackson and paul mccartney,0,0,1,0,0,0,1,the girl is mine,,
michael jackson with siedah garrett,0,0,1,0,0,0,1,i just cant stop loving you,both,
michael johnson,0,1,0,0,0,0,1,bluer than blue,male,American_country_singers
michael martin murphey,0,1,0,0,0,0,1,wildfire,male,American_country_singers
michael mcdonald,0,0,2,0,0,0,2,"i keep forgettin every time youre near, sweet freedom",male,American_male_singers
michael murphey,0,0,1,0,0,0,1,whats forever for,male,
michael sembello,0,0,1,0,0,0,1,maniac,male,American_male_guitarists
michael w smith,0,0,0,1,0,0,1,place in this world,,
michelle,0,0,0,1,0,0,1,no more lies,,
michelle branch,0,0,0,0,2,0,2,"all you wanted, are you happy now",female,American_female_country_singers
mickey gilley,0,0,1,0,0,0,1,stand by me,male,American_country_singers
miguel,0,0,0,0,0,3,3,"sure thing, adorn, adorn",male,American_male_singer-songwriters
mike  the mechanics,0,0,3,0,0,0,3,"silent running on dangerous ground, all i need is a miracle, the living years",,
mike jones,0,0,0,0,1,0,1,back then,male,African-American_male_rappers
mike oldfield,0,1,0,0,0,0,1,tubular bells,male,English_male_composers
mike posner,0,0,0,0,0,2,2,"cooler than me, please dont go",male,American_male_singer-songwriters
mike post,0,1,0,0,0,0,1,the rockford files,,
mike reno and ann wilson,0,0,1,0,0,0,1,almost paradise,,
mike will madeit,0,0,0,0,0,1,1,23,male,
miley cyrus,0,0,0,0,4,5,9,"see you again, 7 things, the climb, party in the usa, party in the usa, we cant stop, wrecking ball, wrecking ball, adore you",female,American_female_pop_singers
milli vanilli,0,0,4,2,0,0,6,"girl you know its true, girl im gonna miss you, blame it on the rain, baby dont forget my number, blame it on the rain, all or nothing",,
mims,0,0,0,0,1,0,1,this is why im hot,male,African-American_male_rappers
minnie riperton,0,1,0,0,0,0,1,lovin you,female,African-American_female_singers
mint condition,0,0,0,1,0,0,1,breakin my heart pretty brown eyes,,
miranda lambert,0,0,0,0,0,2,2,"the house that built me, mamas broken heart",female,American_female_country_singers
miranda lambert and carrie underwood,0,0,0,0,0,1,1,somethin bad,,
missy elliott,0,0,0,1,7,0,8,"sock it 2 me, hot boyz, get ur freak on, one minute man, work it, work it, gossip folks, lose control",female,African-American_female_singer-songwriters
mitch ryder  the detroit wheels,1,0,0,0,0,0,1,devil with a blue dress ongood golly miss molly,,
mkto,0,0,0,0,0,1,1,classic,,
mo thugs,0,0,0,1,0,0,1,ghetto cowboy,,
moby,0,0,0,0,1,0,1,south side,,
mocedades,0,1,0,0,0,0,1,eres tu,,
mokenstef,0,0,0,1,0,0,1,hes mine,,
monica,0,0,0,6,2,0,8,"dont take it personal just one of dem days, before you walk out of my life  like this and like that, why i love you so much  aint nobody, for you i will, the first night, angel of mine, so gone, u shouldve known better",female,African-American_female_singer-songwriters
monifah,0,0,0,1,0,0,1,touch it,female,African-American_female_singer-songwriters
montell jordan,0,0,0,3,1,0,4,"this is how we do it, whats on tonight, lets ride, get it on tonite",male,American_male_singer-songwriters
moody blues,0,0,1,0,0,0,1,your wildest dreams,,
morris albert,0,1,0,0,0,0,1,feelings,male,
motherlode,1,0,0,0,0,0,1,when i die,,
mountain,0,1,0,0,0,0,1,mississippi queen,,
mouth  macneal,0,1,0,0,0,0,1,how do you do,,
moving pictures,0,0,1,0,0,0,1,what about me,,
mr big,0,0,0,2,0,0,2,"to be with you, just take my heart",,
mr cheeks,0,0,0,0,1,0,1,lights camera action,male,
mr mister,0,0,2,0,0,0,2,"broken wings, kyrie",,
mr president,0,0,0,1,0,0,1,coco jambo,,
mr probz,0,0,0,0,0,1,1,waves,male,
mumford  sons,0,0,0,0,0,1,1,i will wait,,
mungo jerry,0,1,0,0,0,0,1,in the summertime,,
murray head,0,0,1,0,0,0,1,one night in bangkok,male,English_male_singers
murray head  the trindad singers,0,1,0,0,0,0,1,superstar,,
musical youth,0,0,1,0,0,0,1,pass the dutchie,,
musiq soulchild,0,0,0,0,2,0,2,"love, halfcrazy",male,African-American_male_singers
my chemical romance,0,0,0,0,1,0,1,welcome to the black parade,,
mystikal,0,0,0,0,2,0,2,"shake ya ass, danger been so long",male,African-American_male_rappers
n ii u,0,0,0,1,0,0,1,i miss you,,
n sync,0,0,0,2,5,0,7,"i want you back, god must have spent a little more time on you, bye bye bye, its gonna be me, this i promise you, girlfriend, gone",,
n sync and gloria estefan,0,0,0,1,0,0,1,music of my heart,,
n2deep,0,0,0,1,0,0,1,back to the hotel,,
naked eyes,0,0,2,0,0,0,2,"always something there to remind me, promises promises",male,
nancy sinatra,1,0,0,0,0,0,1,these boots are made for walkin,female,American_female_country_singers
nas,0,0,0,0,1,0,1,i can,male,African-American_male_rappers
nas and bravehearts,0,0,0,0,1,0,1,oochie wally,,
natalie,0,0,0,0,1,0,1,goin crazy,female,American_female_singers
natalie cole,0,2,2,0,0,0,4,"ive got love on my mind, our love, pink cadillac, miss you like crazy",female,African-American_female_singer-songwriters
natalie la rose,0,0,0,0,0,1,1,somebody,,
natalie merchant,0,0,0,3,0,0,3,"carnival, wonder, jealousy",female,American_female_singer-songwriters
natasha bedingfield,0,0,0,0,4,0,4,"these words, unwritten, pocketful of sunshine, love like this",female,English_female_pop_singers
natural selection,0,0,0,1,0,0,1,do anything,,
naughty boy,0,0,0,0,0,1,1,la la la,,
naughty by nature,0,0,0,4,0,0,4,"opp, hip hop hooray, feel me flow, jamboree",,
nazareth,0,1,0,0,0,0,1,love hurts,,
neil  dara sedaka,0,0,1,0,0,0,1,shouldve never let you go,,
neil diamond,4,3,5,0,0,0,12,"cherry cherry, girl youll be a woman soon, thank the lord for the night time, sweet caroline, cracklin rosie, i ami said, song sung blue, september morn, love on the rocks, america, hello again, yesterdays songs",male,American_male_guitarists
neil diamond  barbra streisand,0,1,0,0,0,0,1,you dont bring me flowers,,
neil sedaka,0,2,0,0,0,0,2,"laughter in the rain, breaking up is hard to do",male,American_male_singer-songwriters
neil sedaka  elton john,0,1,0,0,0,0,1,bad blood,male,
neil young,0,1,0,0,0,0,1,heart of gold,male,Canadian_male_singers
nelly,0,0,0,0,9,2,11,"country grammar hot shit, ride wit me, ei, hot in herre, dilemma, air force ones, my place, over and over, over and over, just a dream, just a dream",male,African-American_male_rappers
nelly furtado,0,0,0,0,5,0,5,"im like a bird, turn off the light, turn off the light, promiscuous, say it right",female,Canadian_female_pop_singers
nelly p diddy and murphy lee,0,0,0,0,1,0,1,shake ya tailfeather,,
nelly paul wall and ali  gipp,0,0,0,0,1,0,1,grillz,,
nelson,0,0,0,2,0,0,2,"cant live without your love and affection, after the rain",,
nena,0,0,1,0,0,0,1,99 luftballons,,
neneh cherry,0,0,1,0,0,0,1,buffalo stance,female,
neon trees,0,0,0,0,0,3,3,"animal, animal, everybody talks",,
new boyz,0,0,0,0,0,2,2,"tie me down, backseat",,
new colony six,1,0,0,0,0,0,1,things id like to say,male,
new edition,0,0,2,2,0,0,4,"cool it now, if it isnt love, hit me off, im still in love with you",male,
new kids on the block,0,0,4,2,0,0,6,"ill be loving you forever, hangin tough, you got it the right stuff, cover girl, step by step, this ones for the children",,
new vaudeville band,1,0,0,0,0,0,1,winchester cathedral,,
new york city,0,1,0,0,0,0,1,im doin fine now,,
next,0,0,0,4,1,0,5,"butta love, too close, i still love you, butta love, wifey",,
neyo,0,0,0,0,8,3,11,"so sick, sexy love, when youre mad, because of you, closer, miss independent, mad, miss independent, let me love you until you learn to love yourself, let me love you until you learn to love yourself, she knows",male,
nick cannon,0,0,0,0,1,0,1,gigolo,male,African-American_male_rappers
nick gilder,0,1,0,0,0,0,1,hot child in the city,male,Canadian_male_singers
nick jonas,0,0,0,0,0,2,2,"jealous, chains",male,American_male_singer-songwriters
nick lachey,0,0,0,0,1,0,1,whats left of me,male,American_male_singers
nickelback,0,0,0,0,11,0,11,"how you remind me, someday, photograph, photograph, savin me, far away, rockstar, if everyone cared, far away, gotta be somebody, if today was your last day",male,
nicki french,0,0,0,1,0,0,1,total eclipse of the heart,female,English_female_pop_singers
nicki minaj,0,0,0,0,0,8,8,"your love, super bass, moment 4 life, starships, pound the alarm, anaconda, only, truffle butter",female,African-American_female_singer-songwriters
nicky jam and enrique iglesias,0,0,0,0,0,1,1,el perdon,,
nico  vinz,0,0,0,0,0,1,1,am i wrong,,
nicole,0,0,0,1,0,0,1,make it hot,,
nicolette larson,0,1,0,0,0,0,1,lotta love,female,American_female_country_singers
nigel olsson,0,1,0,0,0,0,1,dancin shoes,male,English_male_singers
night ranger,0,0,3,0,0,0,3,"sister christian, when you close your eyes, sentimental street",,
nina sky,0,0,0,0,1,0,1,move ya body,,
nine days,0,0,0,0,1,0,1,absolutely story of a girl,,
nirvana,0,0,0,1,0,0,1,smells like teen spirit,,
nitty gritty dirt band,0,1,0,0,0,0,1,mr bojangles,,
nivea,0,0,0,0,1,0,1,dont mess with my man,female,African-American_female_singers
no doubt,0,0,0,1,5,0,6,"just a girl, hey baby, hella good, underneath it all, underneath it all, its my life",,
no mercy,0,0,0,2,0,0,2,"where do you go, where do you go",,
norah jones,0,0,0,0,1,0,1,dont know why,female,American_female_country_singers
nore,0,0,0,0,1,0,1,nothin,,
norman greenbaum,0,1,0,0,0,0,1,spirit in the sky,male,American_male_singers
nu flavor,0,0,0,1,0,0,1,heaven,,
nu shooz,0,0,1,0,0,0,1,i cant wait,,
o c smith,1,0,0,0,0,0,1,little green apples,male,
oasis,0,0,0,1,0,0,1,wonderwall,,
ocean,0,1,0,0,0,0,1,put your hand in the hand,,
odyssey,0,1,0,0,0,0,1,native new yorker,,
of monsters and men,0,0,0,0,0,1,1,little talks,,
ohio express,1,0,0,0,0,0,1,yummy yummy yummy,male,
ohio players,0,4,0,0,0,0,4,"funky worm, fire, love rollercoaster, whod she coo",,
oleta adams,0,0,0,1,0,0,1,get here,female,African-American_female_singers
oliver,2,0,0,0,0,0,2,"jean, good morning starshine",,
olivia newtonjohn,0,8,4,0,0,0,12,"if not for you, let me be there, if you love me let me know, i honestly love you, have you never been mellow, please mr please, hopelessly devoted to you, a little more love, magic, physical, make a move on me, twist of fate",,
olivia newtonjohn  cliff richard,0,0,1,0,0,0,1,suddenly,,
ollie  jerry,0,0,1,0,0,0,1,breakin theres no stopping us,,
olly murs,0,0,0,0,0,1,1,troublemaker,male,English_male_singers
omarion,0,0,0,0,2,1,3,"o, ice box, post to be",male,African-American_male_singers
omi,0,0,0,0,0,1,1,cheerleader,male,
one direction,0,0,0,0,0,5,5,"what makes you beautiful, best song ever, story of my life, drag me down, night changes",male,
onerepublic,0,0,0,0,1,6,7,"stop and stare, all the right moves, secrets, good life, counting stars, counting stars, love runs out",,
onyx,0,0,0,1,0,0,1,slam,male,
orchestral manoeuvres in the dark,0,0,1,0,0,0,1,if you leave,,
orianthi,0,0,0,0,0,1,1,according to you,female,Australian_female_pop_singers
original cast of godspell,0,1,0,0,0,0,1,day by day,,
orleans,0,2,0,0,0,0,2,"dance with me, still the one",male,
ot genasis,0,0,0,0,0,1,1,coco,,
otis redding,1,0,0,0,0,0,1,sittin on the dock of the bay,male,African-American_male_singers
otown,0,0,0,0,1,0,1,all or nothing,,
outkast,0,0,0,1,6,0,7,"elevators me  you, ms jackson, so fresh so clean, the whole world, the way you move, hey ya, roses",,
owl city,0,0,0,0,1,1,2,"fireflies, fireflies",,
owl city and carly rae jepsen,0,0,0,0,0,1,1,good time,,
ozark mountain daredevils,0,1,0,0,0,0,1,jackie blue,,
p diddy,0,0,0,0,2,0,2,"i need a girl part one, i need a girl part two",male,
pablo cruise,0,2,1,0,0,0,3,"whatcha gonna do, love will find a way, cool love",male,
pacific gas  electric,0,1,0,0,0,0,1,are you ready,,
panic at the disco,0,0,0,0,1,0,1,i write sins not tragedies,,
papa roach,0,0,0,0,1,0,1,scars,male,
paper lace,0,1,0,0,0,0,1,the night chicago died,,
paperboy,0,0,0,1,0,0,1,ditty,,
paramore,0,0,0,0,0,3,3,"the only exception, still into you, aint it fun",,
parliament,0,2,0,0,0,0,2,"give up the funk tear the roof off the sucker, flash light",,
passenger,0,0,0,0,0,2,2,"let her go, let her go",male,English_male_singers
pat benatar,0,0,5,0,0,0,5,"heartbreaker, hit me with your best shot, treat me right, love is a battlefield, we belong",female,American_female_rock_singers
patrick hernandez,0,1,0,0,0,0,1,born to be alive,male,French_male_singers
patrick swayze,0,0,1,0,0,0,1,shes like the wind,,
patti austin and james ingram,0,0,1,0,0,0,1,baby come to me,,
patti labelle and michael mcdonald,0,0,1,0,0,0,1,on my own,,
patti page,1,0,0,0,0,0,1,hush hush sweet charlotte,female,American_female_country_singers
patti smith group,0,1,0,0,0,0,1,because the night,both,
patty duke,1,0,0,0,0,0,1,dont just stand there,female,American_female_pop_singers
patty smyth,0,0,0,1,0,0,1,sometimes love just aint enough,female,American_female_rock_singers
paul  linda mccartney,0,1,0,0,0,0,1,uncle albertadmiral halsey,,
paul anka,0,3,0,0,0,0,3,"youre having my baby, i dont like to sleep alone, times of your life",male,American_crooners
paul anka  odia coates,0,1,0,0,0,0,1,one man womanone woman man,,
paul carrack,0,0,1,0,0,0,1,dont shed a tear,male,English_male_singers
paul davis,0,1,2,0,0,0,3,"i go crazy, 65 love affair, cool night",male,American_country_singers
paul mauriat,1,0,0,0,0,0,1,love is blue,,
paul mccartney,0,1,4,0,0,0,5,"another dayoh woman oh why, coming up, take it away, no more lonely nights, spies like us",male,English_male_singer-songwriters
paul mccartney  wings,0,3,0,0,0,0,3,"my love, live and let die, juniors farm",,
paul mccartney and michael jackson,0,0,1,0,0,0,1,say say say,,
paul mccartney and stevie wonder,0,0,1,0,0,0,1,ebony and ivory,male,
paul mccartney and wings,0,3,0,0,0,0,3,"band on the run, jet, helen wheels",,
paul revere  the raiders,4,1,0,0,0,0,5,"kicks, just like me, hungry, mr sun mr moon, indian reservation the lament of the cherokee reservation indian",,
paul simon,0,5,0,0,0,0,5,"mother and child reunion, loves me like a rock, kodachrome, 50 ways to leave your lover, slip slidin away",male,American_male_guitarists
paul stookey,0,1,0,0,0,0,1,the wedding song there is love,male,American_male_guitarists
paul young,0,0,1,1,0,0,2,"everytime you go away, oh girl",male,English_male_singers
paula abdul,0,0,3,4,0,0,7,"straight up, cold hearted, forever your girl, its just the way that you love me, rush rush, the promise of a new day, blowing kisses in the wind",female,American_female_pop_singers
paula abdul and the wild pair,0,0,0,1,0,0,1,opposites attract,,
paula cole,0,0,0,2,0,0,2,"where have all the cowboys gone, i dont want to wait",female,American_female_singer-songwriters
paula deanda,0,0,0,0,1,0,1,walk away remember me,female,American_female_singers
peabo bryson,0,0,1,0,0,0,1,if ever youre in my arms again,male,African-American_male_singers
peabo bryson and regina belle,0,0,0,1,0,0,1,a whole new world,,
peabo bryson and roberta flack,0,0,1,0,0,0,1,tonight i celebrate my love,,
peaches  herb,1,2,1,0,0,0,4,"close your eyes, reunited, shake your groove thing, i pledge my love",,
pearl jam,0,0,0,2,0,0,2,"i got id, last kiss",,
pebbles,0,0,2,1,0,0,3,"girlfriend, mercedes boy, giving you the benefit",female,
people,1,0,0,0,0,0,1,i love you,,
percy sledge,2,0,0,0,0,0,2,"when a man loves a woman, take time to know her",,
perry como,0,1,0,0,0,0,1,somos novios its impossible,male,American_crooners
pet shop boys,0,0,2,0,0,0,2,"west end girls, always on my mind",,
pet shop boys with dusty springfield,0,0,1,0,0,0,1,what have i done to deserve this,,
pete townshend,0,0,1,0,0,0,1,let my love open the door,,
peter and gordon,4,0,0,0,0,0,4,"i go to pieces, true love ways, lady godiva, woman",male,British_male_singers
peter brown,0,1,0,0,0,0,1,dance with me,male,American_male_singers
peter cetera,0,0,2,0,0,0,2,"glory of love, one good woman",male,American_male_singer-songwriters
peter cetera and amy grant,0,0,1,0,0,0,1,the next time i fall,,
peter frampton,0,3,0,0,0,0,3,"show me the way live, baby i love your way live, im in you",male,English_male_singers
peter gabriel,0,0,2,0,0,0,2,"sledgehammer, big time",male,English_male_singers
peter mccann,0,1,0,0,0,0,1,do you wanna make love,male,American_male_singers
peter paul and mary,1,0,0,0,0,0,1,i dig rock and roll music,,
peter schilling,0,0,1,0,0,0,1,major tom coming home,,
petey pablo,0,0,0,0,1,0,1,freekaleek,male,African-American_male_rappers
petula clark,5,0,0,0,0,0,5,"downtown, i know a place, my love, this is my song, dont sleep in the subway",female,English_female_pop_singers
pharrell,0,0,0,0,1,0,1,frontin,male,
pharrell williams,0,0,0,0,0,1,1,happy,male,African-American_male_rappers
phil collins,0,0,8,5,0,0,13,"you cant hurry love, against all odds take a look at me now, one more night, sussudio, dont lose my number, take me home, a groovy kind of love, two hearts, another day in paradise, do you remember, i wish it would rain down, something happened on the way to heaven, everyday",male,English_male_singer-songwriters
phil collins and marilyn martin,0,0,1,0,0,0,1,separate lives,both,
philip bailey and phil collins,0,0,1,0,0,0,1,easy lover,,
phillip phillips,0,0,0,0,0,3,3,"home, home, gone gone gone",male,American_male_guitarists
phoebe snow,0,1,0,0,0,0,1,poetry man,female,American_female_guitarists
pilot,0,1,0,0,0,0,1,magic,,
pink,0,0,0,0,13,5,18,"there you go, most girls, most girls, get the party started, dont let me get me, just like a pill, stupid girls, u  ur hand, who knew, so what, sober, so what, please dont leave me, raise your glass, fuckin perfect, blow me one last kiss, just give me a reason, try",female,American_female_pop_singers
pink floyd,0,1,1,0,0,0,2,"money, another brick in the wall part ii",,
pitbull,0,0,0,0,2,6,8,"i know you want me calle ocho, hotel room service, give me everything, hey baby drop it to the floor, international love, back in time, feel this moment, timber",,
pitbull and neyo,0,0,0,0,0,1,1,time of our lives,,
plain white ts,0,0,0,0,1,0,1,hey there delilah,,
planet soul,0,0,0,1,0,0,1,set u free,,
player,0,2,0,0,0,0,2,"baby come back, this time im in it for love",,
plies,0,0,0,0,3,0,3,"shawty, bust it baby part 2, hypnotized",male,African-American_male_rappers
pm dawn,0,0,0,4,0,0,4,"set adrift on memory bliss, id die without you, looking through patient eyes, id die without you",male,
pointer sisters,0,0,2,0,0,0,2,"jump for my love, automatic",female,
poison,0,0,2,2,0,0,4,"nothin but a good time, every rose has its thorn, unskinny bop, something to believe in",,
portrait,0,0,0,1,0,0,1,here we go again,,
positive k,0,0,0,1,0,0,1,i got a man,male,African-American_male_rappers
power station,0,0,1,0,0,0,1,some like it hot,male,
pras michel,0,0,0,1,0,0,1,ghetto supastar that is what you are,,
pretty poison,0,0,1,0,0,0,1,catch me im falling,,
pretty ricky,0,0,0,0,3,0,3,"grind with me, your body, on the hotline",,
prince,0,0,7,2,0,0,9,"i wanna be your lover, little red corvette, 1999, when doves cry, u got the look, sign o the times, batdance, thieves in the temple, the most beautiful girl in the world",male,African-American_male_singers
prince and the new power generation,0,0,0,3,0,0,3,"cream, diamonds and pearls, 7",,
prince and the revolution,0,0,3,0,0,0,3,"lets go crazy, raspberry beret, kiss",,
procol harum,1,0,0,0,0,0,1,a whiter shade of pale,,
pseudo echo,0,0,1,0,0,0,1,funkytown,,
psy,0,0,0,0,0,2,2,"gangnam style, gangnam style",male,
public announcement,0,0,0,1,0,0,1,body bumpin yippieyiyo,,
puddle of mudd,0,0,0,0,2,0,2,"blurry, she hates me",,
puff daddy,0,0,0,6,0,0,6,"ill be missing you, cant nobody hold me down, been around the world, come with me, victory, satisfy you",,
pure prairie league,0,0,1,0,0,0,1,let me love you tonight,,
pussycat dolls,0,0,0,0,5,0,5,"buttons, stickwitu, beep, when i grow up, i hate this part",,
quad city djs,0,0,0,1,0,0,1,cmon n ride it the train,,
quarterflash,0,0,2,0,0,0,2,"harden my heart, take me to heart",,
queen,0,5,2,1,0,0,8,"killer queen, bohemian rhapsody, youre my best friend, somebody to love, we will rock youwe are the champions, crazy little thing called love, another one bites the dust, bohemian rhapsody",,
queen latifah,0,0,0,1,0,0,1,unity,female,African-American_female_singer-songwriters
"queensr""yche",0,0,0,1,0,0,1,silent lucidity,,
quiet riot,0,0,1,0,0,0,1,cum on feel the noize,,
quincy jones,0,0,1,0,0,0,1,one hundred ways,,
r city,0,0,0,0,0,1,1,locked away,,
r dean taylor,0,1,0,0,0,0,1,indiana wants me,,
r kelly,0,0,0,8,9,0,17,"bump n grind, your bodys callin, i cant sleep baby if i, down low nobody has to know, you remind me of something, i believe i can fly, gotham city, when a womans fed up, fiesta, i wish, ignition remix, thoia thoing, step in the name of love, step in the name of love, happy people, im a flirt, same girl",male,
r kelly and celine dion,0,0,0,1,0,0,1,im your angel,,
rachel platten,0,0,0,0,0,1,1,fight song,female,American_female_singer-songwriters
rae sremmurd,0,0,0,0,0,1,1,no type,male,
ralph tresvant,0,0,0,1,0,0,1,sensitivity,male,American_male_singers
ramsey lewis trio,1,0,0,0,0,0,1,the in crowd,male,
randy houser,0,0,0,0,0,1,1,runnin outta moonlight,male,American_country_singers
randy newman,0,1,0,0,0,0,1,short people,male,American_male_singer-songwriters
randy vanwarmer,0,1,0,0,0,0,1,just when i needed you most,male,American_male_guitarists
raphael saadiq,0,0,0,1,0,0,1,ask of you,male,African-American_male_singers
rare earth,0,3,0,0,0,0,3,"get ready, i know im losing you, i just want to celebrate",male,
rascal flatts,0,0,0,0,2,0,2,"what hurts the most, life is a highway",,
raspberries,0,1,0,0,0,0,1,go all the way,,
ratt,0,0,1,0,0,0,1,round and round,,
ray charles,2,0,0,0,0,0,2,"crying time, here we go again",male,African-American_male_singers
ray conniff singers,1,0,0,0,0,0,1,somewhere my love,male,
ray goodman  brown,0,0,1,0,0,0,1,special lady,,
ray j,0,0,0,1,2,0,3,"let it go, one wish, sexy can i",male,African-American_male_rappers
ray parker jr,0,0,3,0,0,0,3,"the other woman, ghostbusters, i still cant get over loving you",male,
ray stevens,1,3,0,0,0,0,4,"gitarzan, everything is beautiful, the streak, misty",male,American_country_singers
raydio,0,2,1,0,0,0,3,"jack and jill, you cant change that, a woman needs love just like you do",,
ready for the world,0,0,2,0,0,0,2,"oh sheila, love you down",male,
real mccoy,0,0,0,5,0,0,5,"another night, another night, run away, come and get your love, one more time",both,
red hot chili peppers,0,0,0,2,3,0,5,"under the bridge, scar tissue, otherside, dani california, snow hey oh",,
redbone,0,2,0,0,0,0,2,"the witch queen of new orleans, come and get your love",,
rednex,0,0,0,1,0,0,1,cotton eye joe,both,
regina,0,0,1,0,0,0,1,baby love,,
rem,0,0,1,2,0,0,3,"stand, losing my religion, shiny happy people",,
reo speedwagon,0,0,4,0,0,0,4,"keep on loving you, take it on the run, keep the fire burnin, cant fight this feeling",,
restless heart,0,0,0,1,0,0,1,when she cries,,
rex smith,0,1,0,0,0,0,1,you take my breath away,male,American_male_singers
rhythm heritage,0,1,0,0,0,0,1,theme from swat,,
rich boy,0,0,0,0,1,0,1,throw some ds,male,African-American_male_rappers
rich gang,0,0,0,0,0,1,1,lifestyle,,
rich homie quan,0,0,0,0,0,1,1,flex ooh ooh ooh,male,African-American_male_rappers
